{
  "id": "ui.roundTimer.v1",
  "name": "Round Timer UI",
  "category": "ui",
  "engine": "phaser",
  "version": "0.1.0",
  "description": "UI kit manifest for round time display.",
  "provides": ["roundTimerHud"],
  "requires": ["runtime.uiLayer"],
  "compatibleWith": {
    "templates": ["template.miniAction.v1"],
    "inputs": ["mobile_drag"]
  },
  "tunables": {
    "roundTimeSec": {
      "type": "number",
      "default": 60,
      "min": 10,
      "max": 180
    }
  },
  "invariants": ["mustNotAlterPhysics"],
  "entry": "src/kits/ui/roundTimer/RoundTimerUI.ts"
}
